{
  "business_unit": {
    "service_id": "15594097555922f97bfeb148d6b9a6ef76f76ebdce",
    "organization_number": "556838-8200",
    "name": "Findity store AB",
    "contact": {
      "address": {
        "street_address": "Engelbrektsgatan 20",
        "locality": "Ludvika",
        "postal_code": "77187"
      },
      "phone": "+460771584886"
    }
  },

  "cashier": {
    "id": "5",
    "name": "Anna Andersson"
  },
  "sales_recording_system": {
    "serial_number": "EA38329",
    "name": "kassa 3"
  },
  "receipt_identifier": {
    "sequence_number": 123456,
    "extended_number": {
      "value": "0123456123",
      "type": "EAN8",
      "context": "store"
    }

  },
  "time_of_purchase": "2018-11-09T08:49:00+01:00",
  "currency": "SEK",

  "totals": [{
      "type": "net",
      "amount": 280.00
    },
    {
      "type": "vat",
      "amount": 70.00,
      "sub_totals": [{
        "amount": 70.00,
        "taxable_amount": 350.00,
        "net_amount": 280.00,
        "tax_percentage": 25
      }]
    },
    {
      "type": "gross",
      "amount": 395.00
    },
    {
      "type": "discount",
      "amount": 45.00
    },
    {
      "type": "rounding",
      "amount": 0.00
    },
    {
      "type": "paid",
      "amount": 350.00
    }
  ],

  "header_text": {
    "type": "array",
    "collection": [
      "Öppettider: Mådag - Fredag 10-18 Lördag 10-15",
      "Another header text..."
    ]
  },
  "footer_text": {
    "type": "array",
    "collection": [
      "Sommarerbjudande: Köp 3 par skor få det billigaste paret på köpet."
    ]
  },

  "items": [{
    "type": "sale",
    "entry_method": "scanned",
    "identifiers": [{
        "identifier_type": "pos",
        "value": "912042"
      },
      {
        "identifier_type": "gtin",
        "value": "1234567890"
      }
    ],
    "description": "Skor 42 - Foder BR",
    "quantity": {
      "value": 1,
      "unit": "ea"
    },
    "regular_sales_unit_price": 395,
    "retail_price_modifiers": [{
      "amount": 45,
      "action": "subtract",
      "description": {
          "type": "array",
          "collection": ["Rabatt på alla skor"]
      }
    }],
    "actual_sales_unit_price": 350,
    "extended_amount": 350,
    "extended_gross_amount": 350,
    "tax_percentage": 25,
    "sequence_number": 1
  }],

  "retail_price_modifiers": [{
    "amount": 35.00,
    "percent": 10,
    "description": {
        "type": "array",
        "collection": ["10% of, todays special"]
    }
  }],

  "payments": [{
    "tender": {
      "type": "cash"
    },
    "amount_applied_to_bill": 315.00,
    "amount": 315.00,
    "foreign_currency_amount": {
      "currency": "EUR",
      "original_face_amount": 30.08,
      "exchange_rate": 10.4728
    }
  }],

  "customer": {
    "id": {
      "phone": "+46 75 777 7777"
    }
  },

  "control_unit": {
    "id": "RIHTT102710007088",
    "code": "BGXOV2QOHHILXHLPHHXRAYZEKGFNC2BD;"
  }
}
