{
  "business_unit": {
    "service_id": "15594097555922f97bfeb148d6b9a6ef76f76ebdce",
    "organization_number": "556838-8200",
    "name": "Findity store AB",
    "contact": {
      "address": {
        "street_address": "Engelbrektsgatan 20",
        "locality": "Ludvika",
        "postal_code": "77187"
      },
      "phone": "+460771584886"
    }
  },

  "cashier": {
    "id": "5",
    "name": "Anna Andersson"
  },
  "sales_recording_system": {
    "serial_number": "EA38329",
    "name": "kassa 3"
  },
  "receipt_identifier": {
    "sequence_number": 123456,
    "extended_number": {
      "value": "0123456123",
      "type": "EAN8",
      "context": "store"
    }

  },
  "time_of_purchase": "2018-11-09T08:49:00+01:00",
  "currency": "SEK",

  "totals": [{
      "type": "net",
      "amount": 41.00,
      "refund": false
    },
    {
      "type": "vat",
      "amount": 7.00,
      "refund": false,
      "sub_totals": [{
        "amount": 7.00,
        "taxable_amount": 46.00,
        "net_amount": 39.00,
        "tax_percentage": 12,
        "refund": false
      }]
    },
    {
      "type": "gross",
      "amount": 66.00,
      "refund": false,
      "sub_totals": [{
        "type": "eligible_for_frequent_shopper_points",
        "amount": 60.00,
        "points": 20,
        "refund": false,
        "text": {
          "type": "array",
          "collection": ["Bonusgrundande belopp"]
        }
      }]
    },
    {
      "type": "rounding",
      "amount": 0.00
    },
    {
      "type": "paid",
      "amount": 46.00,
      "refund": false,
      "sub_totals": [{
          "type": "received",
          "amount": 50.00,
          "text": {
            "type": "array",
            "collection": ["Mottaget"]
          }
        },
        {
          "type": "returned",
          "amount": 4.00,
          "text": {
            "type": "array",
            "collection": ["Växel"]
          }
        }
      ]
    },
    {
      "type": "discount",
      "amount": 20.00,
      "refund": true,
      "sub_totals": [{
        "amount": 13.00,
        "refund": true,
        "type": "loyalty"
      }]
    }
  ],

  "header_text": {
    "type": "array",
    "collection": [
      "Öppettider: Mådag - Fredag 10-18",
      "Lördag 10-15"
    ]
  },
  "items": [{
      "type": "sale",
      "identifiers": [{
        "identifier_type": "pos",
        "value": "912040"
      }],
      "description": "Mumsig läskedryck svart",
      "quantity": {
        "value": 1,
        "unit": "l"
      },
      "eligible_for_frequent_shopper_points": true,
      "actual_sales_unit_price": 20.00,
      "extended_amount": 20.00,
      "regular_sales_unit_price": 20.00,
      "extended_gross_amount": 20.00,
      "tax_percentage": 12,
      "sequence_number": 1
    },
    {
      "type": "deposit",
      "amount": 2.00,
      "unit_amount": 2.00,
      "quantity": 1,
      "refund": false,
      "sequence_number": 2,
      "item_link": 1
    },
    {
      "type": "sale",
      "identifiers": [{
        "identifier_type": "pos",
        "value": "912041"
      }],
      "description": "Mumsig läskedryck röd",
      "quantity": {
        "value": 1,
        "unit": "l"
      },
      "eligible_for_frequent_shopper_points": true,
      "actual_sales_unit_price": 20.00,
      "extended_amount": 20.00,
      "regular_sales_unit_price": 20.00,
      "extended_gross_amount": 20.00,
      "tax_percentage": 12,
      "sequence_number": 3
    },
    {
      "type": "deposit",
      "amount": 2.00,
      "unit_amount": 2.00,
      "quantity": 1,
      "refund": false,
      "sequence_number": 4,
      "item_link": 3
    },
    {
      "type": "sale",
      "identifiers": [{
        "identifier_type": "pos",
        "value": "912042"
      }],
      "description": "Mumsig läskedryck orange",
      "quantity": {
        "value": 1,
        "unit": "l"
      },
      "eligible_for_frequent_shopper_points": true,
      "actual_sales_unit_price": 20.00,
      "extended_amount": 20.00,
      "regular_sales_unit_price": 20.00,
      "extended_gross_amount": 20.00,
      "tax_percentage": 12,
      "sequence_number": 5
    },
    {
      "type": "deposit",
      "amount": 2.00,
      "unit_amount": 2.00,
      "quantity": 1,
      "refund": false,
      "sequence_number": 6,
      "item_link": 5
    }
  ],

  "retail_price_modifiers": [{
    "amount": 20.00,
    "action": "subtract",
    "description": {
      "type": "array",
      "collection": ["3 läsk betala för 2"]
    },
    "item_links": [
      1, 3, 5
    ]
  }],

  "payments": [{
    "tender": {
      "type": "cash"
    },
    "refund": false,
    "amount_applied_to_bill": 46.00,
    "amount": 50.00
  }, {
    "tender": {
      "type": "cash"
    },
    "refund": true,
    "amount_applied_to_bill": 4.00,
    "amount": 4.00
  }],

  "customer": {
    "id": {
      "phone": "+46 75 777 7777"
    }
  },

  "control_unit": {
    "id": "RIHTT102710007088",
    "code": "BGXOV2QOHHILXHLPHHXRAYZEKGFNC2BD;"
  }
}
